PingStatus,"A lightweight, yet handy application that helps you monitor your Internet connection speed by displaying the number of packets sent"
NetworkInterfacesView,"View all network devices connected to your computer, customize the display and generate HTML reports with this powerful application"
LDAPSoft AD Browser,"You can easily access and explore the attributes of a network's Active Directory, run SQL statements or export values, with this tool"
Maxidix Wifi Suite,A useful and reliable application that gives you full control over Wi-Fi connections and enables you to get all the information available about Wi-Fi networks
Pinger,You can work with this lightweight and simple application to determine whether certain hosts are online by performing ping tests
GhostMAC,Change the MAC address of your computer with this simple-to-use software utility that also features support for restoring it to default
SurveilStar,"Monitor every employee computer from office networks including their search history, emails, chats, visited websites and many others"
SysMate - Hosts File Walker,"Modify the Hosts file easily using this simple and portable app that lets you add new entries, delete the Hosts, restore settings to default, as well as back up and restore data"
Whois Extractor,"Quickly find and extract information about multiple web domains, then save it to CSV or TXT files, with this handy software solution"
IPView,Get your IP address and copy the information to the clipboard so you can paste it into other third-party tools with the aid of this portable program
NetRouteView,A practical an easy to use route tool designed to be a GUI alternative to the standard Route.exe which you can also use as a command line application
Ping Lite,"Ping a single IP, domain name or hostname with this simplistic and user-friendly software solution that also comes with a Graphical User Interface"
EMCO MAC Address Scanner,A network scanning tool that allows to detect MAC addresses of network PCs and store them into XML as well as CSV files on-the-fly
No-IP DUC,"Provides you with an easy to remember name instead of long hard to remember IP address, so that your friends or your customers can easily find your PC on the web"
W4H Hotspot,Create new WiFi hotspots with this intuitive application that supports expiration timers and allows administrators to be notified when a user has connected
Smart DNS Changer & MAC Address Changer,"With this application, you can change the DNS or MAC address on your system, to ensure your children do not come across any harmful content on the Internet"
VisLogic Lan-Inspector Enterprise Edition,"Create a comprehensive inventory of hardware components and software installed on networked computers, with this powerful application"
LanDetective Professional,"Network sniffer that helps you capture web, FTP, email and chat data, generate logs and reports based on the captured Internet traffic, and apply filters"
10-Strike Network File Search,"Search for files on shared resources and FTP servers, apply filters by size, date and extension (e.g. MP3, AVI, PDF, XLS), and export the report with results to HTML or plain text file format"
10-Strike Network File Search Pro,"Search for files on your local network and FTP servers, delete unnecessary items and export results to various document formats, with this handy application"
NetworkActiv PortImport,"A complex, yet easy to use application that enables you to access ports of computers protected by firewalls by performing reverse port forwarding operations"
Free WiFi Hotspot,"A straightforward program that helps you share your wireless connection with your friends or other users, while offering support for passwords"
Daihinia,Easily set up an Ad-Hoc WiFi network by following a few guided steps and enjoy a flawless connection using this practical application
Web site down!,Effortlessly keep an eye on your website's host and check its current status (online of offline) with the help of this streamlined and small app
Virtual WIFI,Turn your computer into a virtual router and set up a WiFi hotspot with the help of this user-friendly and practical piece of software
Advanced Network Configurator,"A simple to use application which allows you to create and monitor a large series of network profiles, as well as configure IP addresses"
Internet Administrator,"Monitor mirroring ports and Internet traffic in your network, block certain connections or set user permissions, with this program"
Vistumbler,"Lightweight and simple-to-use application that detects nearby wireless access points that you can connect to, and features GPS support"
Whois Master,View WhoIs information on a specified domain and take advantage of the option to copy the details to the clipboard and use them in other applications
Trogon Network Inventory,Access information about the computers on your network and track configuration changes remotely with this intuitive piece of software
Socket Spy,Investigate Windows Socket traffic and algorithm from your network with the help of this comprehensive and reliable software solution
System Proxy Switcher,"Quickly change the external IP of your system, by manually specifying the desired proxy address, as well as the port that you wish to use"
NetworkView,"Monitor your networks with this powerful tool, that identifies TCP/IP nodes using various methods, creates maps and sends alerts"
NetConnectChoose,"Set the default Internet connection for all applications requesting web access when using multiple network adapters, and analyze detailed information"
Domain Whois Checker,"Check the availability of several domain names and keep an eye on your domain's expiration date, so as to renew your subscription"
Baidu WiFi Hotspot,"Create a wireless Internet hotspot to which you can connect with your phone, even being able to transfer files from and to the device"
NET-SMART,"Monitor the activity of the hard drives in the systems connected to the local network, in order to detect irregularities or errors"
DM SysLog Monitor,"Capture SysLog traffic transmitted by routers or other devices, analyze received messages, and automatically save log details to file"
Network Traffic Monitor,"Keep an eye on incoming and outgoing data packets through your network adapter and set up limits to receive alerts with this practical, straightforward tool"
TimeAxon,A simple and efficient application developed in order to provide you with the quickest means of synchronizing your network computers' date and time
ClockAxon,A simple and easy to use application whose main function is to help companies or other businesses synchronize the time on all their computers
AuditAxon,"A simple network auditing utility designed for SNMP service computers, allowing you to determine license of the installed software"
LogAxon,A simple and reliable application designed to monitor and collect Syslog messages and SNMP traps occurring between the devices of your network
LAN Administrator,"Lightweight application which enables you to gather information pertaining to your local area network, manage hosts and save data to the HDD"
Jagacy TN3270 Emulator,"Emulator for various IBM terminals with configurable properties, which supports the Secure Sockets Layer technology and proxy connections"
hpObserver,Check whether sites and IPs are alive with this easy-to-use application that allows users to set up recurring scans with five different validating methods
SyncThru Web Admin Service for SCX-4623FW,A fleet management solution for multiple networked printers
SyncThru Web Admin Service for SCX-4623F,A fleet management solution for multiple networked printers
Verax NMS & APM (formerly Verax NMS Express),"A reliable software that provides service-oriented, unified management & monitoring of networks, applications and infrastructure enabling quick problem detection"
Hyper Ping,"Easily calculate the ping time, estimated between your IP address and the selected public server, with the help of this simple program"
SquidNet Network Distribution Processor,A complex application for network adminstators
Ufasoft Snif,Track the data being transferred in the local network with this application that can display statistics and export results to PCAP format
Network Intrusion detection system - Sax2,Capture packets in real time and enjoy 24/7 network monitoring and automatic detection with this comprehensive piece of software
Unicorn Network Analyzer,"This simple to use application is a protocol analyzer or packet sniffer, designed to help you with ethernet network monitoring and troubleshooting"
RWanIP,"Polls your external WAN IP address and uploads it to a FTP server, so you can easily retrieve this information no matter where you are"
IP Locator,Get detailed information about IP addresses and view their location on the map by using this user-friendly and compact application
Wi-Fi Hotspot,"Create a Wireless hotspot and share your Internet connection with others, using this straightforward and lightweight application"
Cisco Device Info,Retrieve information from Cisco routers and switches via the SNMP protocol using this fast and approachable tool that lets you configure device settings
ettercap,"A suite of components and libraries that can be used to sniff and log the activity inside a network, being able to prevent man-in-the-middle attacks"
SoftHotspot,"Turn your computer into a hotspot and share the Internet connection to smartphones, tablets, laptops or other devices, with this tool"
Maxidix IP Switcher,"Comprehensible and efficient software utility that enables users to create multiple network profiles, in order to easily toggle IP and DNS settings"
WirelessMon,"Detect, monitor & map (including GPS) wireless networks (WiFi) by turning to this lightweight, yet powerful software application"
Alien IP,"Search for IP addresses, localize them on the world map and test their response, thus discovering who visits your website, shares files or makes payments"
Connect Now,"A user-friendly and straightforward program created to help you establish a Wi-Fi hotspot, so you can share your Internet connection"
Maxidix Wifi Autoconnection,A straightforward and efficient software utility designed to help you setup and configure automatic connections to wireless networks for your computer
openCONFIGURATOR,A user-friendly Ethernet POWERLINK configuration tool that you can use to easily configure and administer your POWERLINK connections
AdSysNet AD Logon Reporter,Active Directory administrators can easily monitor the user's logon attempts and view reports with successful or failed procedures
My Network Speed,Monitor your network cards with the help of this handy and lightweight application that allows you to view the download and upload speeds in real time
AdSysNet LDAP Searcher,"Network administrators can easily search for Active Directory objects, as well as run queries against AD Objects, with this reliable application"
Inet/Winet Terminal Emulator,"A terminal emulator that features an integrated FTP client and RTF network printing options, securing connections via the SSL or SSH protocols"
DSA's MTTTY,An easy to use application that allows you to quickly connect to a COM port in order to monitor the performance of the attached device
Essential NetTools,A comprehensive set of specialized tools that can be useful in diagnosing networks and monitoring your computer's network connections
Trogon MAC Scanner,Administrate and maintain the well-being of your network by turning to this tool that can help you retrieve various useful information
Network Connection Repair Tool,A simple means of fixing Brother printers and restore their main functionality
Netflow Collector,Windows service based Netflow collector
Acid Scanner Free,"Scan and monitor your internet network, either with administrator or simple user access, unconver threats and make all sort of changes"
Network Uptime Analyzer,Find out how many PCs are left on overnight
ZOLA Connection Troubleshooter,"A potent and reliable application that can help you determine if there are any network connection problems, then instantly fix them"
YourWanIP,A lightweight and compact application that regularly checks your Wide Area Network IP address and informs you when a change occurs
SerialSniffer Standard Edition,A useful utility to tunnel the serial port through the network
SerialSniffer VSP Edition,Tool to visualize data on serial ports / comports and to log or record them
ZoneEdit Dyn Updater,A Domain Name System updater that you can carry with you anywhere in order to quickly synchronize domain names with IP addresses
WiSE,"A lightweight program that can be used for monitoring who connects to your Internet, being able to block them if you disapprove of their actions"
Multi Whois,A lightweight whois application that can help you search for available domains that you can purchase and find out detailed information about a certain domain
Free Hotspot Creator,"With this simple and user-friendly program, you can allow all other people to access your Internet connection and browse the web"
SolarWinds CatTools,"Network Management & Device Config Tools. Routers, Switches, Firewalls"
Switch Checker,Gather data about all the ports connected to detect and resolve any issues using this straightforward and portable software tool
ConsoleX,A very useful console to help you with your work
SysUpTime,Gather topology data to deliver complete and accurate maps of devices and connectivity across networks
SocketSniff,"Lightweight application which enables you to monitor the Windows Sockets activity of a specified process, generate HTML reports and use a search feature"
.NET SOAP Client,A SOAP client to help you with your work.
TwoBind,"A simple port forwarding solution that listens on both ends, capturing data sent by any client that connects to any of the two ports"
MindArray Minder,"A reliable network monitoring application, which offers comprehensive SLA management, unified process supervision and centralized events"
FastResolver,A user-friendly application that was designed to help you search and view all the MAC addresses from anywhere within your local network
AutoVPNConnect,"A straightforward and effective piece of software that allows you to automatically connect to your VPN network, thus protecting your sensitive data"
USB Redirector RDP Edition,Share and access USB devices over LAN or Internet
DDNS Updater,"A simple to use application dedicated to monitoring the dynamics of your network, detect if the IP address changes and update it to your domain name"
My WIFI Router,A practical and effective utility whose main purpose is to help you share your Internet to other devices and easily transfer video files
Service Timer,A straightforward piece of software that is especially designed for network administrators who want to remotely manage running services
Modbus Master,Facilitate the communication between ModBus RTU and TCP slaves using this portable program and make use of a Modbus monitor that keeps an eye on the ongoing traffic
IP Address Manager,"Powerful, comprehensive and user-friendly software application that allows you to easily manage the IP address usage on your network"
Adminner,"A lightweight and reliable tool aimed at network administrator to help them control services, computers, files, accounts in their LAN"
Blight Tester X,"A user-friendly software solution that enables you to thoroughly analyze the chosen URL and detect its vulnerabilities, so that admins can patch them"
GNS-3,"Graphical network simulator for creating designs with computers connected via LAN, routers, switches and other components, with support for inserting pictures and changing symbols"
Argon Network Switcher,"Unobtrusive application which enables you to view information about a network card and create multiple profiles, so as to switch between them"
AutoAdministrator,A powerful network management utility that helps you keep an eye on all the workstations and servers and perform common maintenance operations
Mindterm,"Java-based SSH client that offers support for tunneling, file transfers, SOCKS and HTML proxies, which does not need installation (aside from Java)"
Network Intrusion detection system - Sax2 Free,A powerful intrusion detection and packet monitoring application designed to ease the work of all network administrators as far as security is concerned
Alloy Discovery Free Edition,"Create an inventory of installed software and devices, printers, shared folders and other data about computers in the local network by auditing them"
Network Activity Indicator,"Simple tool that doesn't need installation, displaying the old 'two monitors' icon in Windows 7 for network connection in system tray"
PingDoS,"A small ping utility useful for all network administrators that comes with various other commands, such as 'ipconfig', tasklist, tracerouting and nslookup functions"
XIA Links,"A comprehensive application, designed especially for network administrators, which allows them to control which programs can be accessed by users on the newtork"
Reset TCPIP,"Lightweight, free and portable application that immediately fixes TCP / IP issues if the network settings are experiencing issues"
My CyberCafe,"Powerful management solution for Internet cafes, comprising a server and client utility, which allows admins to restrict user access and schedule automatic tasks"
Ping Tools Plus,An easy-to-use application designed to measure the duration of sending data back and forth between a hostname or an IP address and the host computer
PYNBM,Python Network Bookmark Manager
vTrace,"Tracerouting, host ping functions, whois data, DNS queries, nslookup and a simple port scanner in a single comprehensive package"
SoftPerfect Network Protocol Analyzer,A comprehensive and reliable network sniffer that helps network administrators to analyze and monitor networks and Internet connections
IPNow Manager,"A simple to use tool that enables you to obtain the IP used by your station for online identification, as well as the Internet service provider"
10-Strike MP3-Scanner,"Search computers in the local network for MP3, MP2 and WMA files, create playlists, as well as copy music to your own hard disk drive"
Vidalia Bundle,"A cross-platform controller GUI specially designed to allow you to use the Tor software, as well as to view and analyze the bandwidth usage"
10SCAPE Network,"A practical and easy to use application especially created to help you build complex network maps in little time, with minimum effort"
CConnect,Protect your virtual identity by connecting to one of the many VPN servers spread across the globe in order to make your IP address difficult to track down
Webtile Network Discovery,"A simple to use IP tool that enables you to verify the speed and accuracy of the network response for a certain station, as well as trace routes"
SNTP Service,Advanced synchronization software for Simple Network Time Protocol
SharePort Plus (formerly SharePort Utility),"This lightweight application provides you with a simple means of connecting your computer to server-attached devices, such as USB printers"
DomainWhoIs,"A simple to use program that allows you to search for Who Is information regarding domains, IP addresses using several lookup servers"
Maxidix HotSpot,"Turn your computer's wireless network adapter into an Internet access point for other devices to connect to, and manage the network's infrastructure"
NetVidi,"A vendor neutral network infrastructure management tool that allows you to discover network devices, collect configuration information and generate reports"
fullmo Kickdrive,Test CAN / CANopen networks with ease
Netwrix Active Directory Change Reporter,"Monitors the Windows Active Directory for new changes, generates reports with the person, event type, date and location, and lets you set automatic email notifications"
Advanced Virtual COM Port,"A simple, easy-to-use application that allows you to share COM ports or create virtual ones connected with virtual NULL-modem cable"
pcapfix,Fixes broken pcap files
Cisco Powerline AV Utility,Enhance the range of your wireless router or access point
PrinterShare,"A software application that lets users to print documents on other computer's printers, as long as they are connected to the same local network"
JSNMPWalker,A Java Swing application to run multiple SNMP sessions simultaneously with the possibility of results to be saved into a file of your choice
Net StreetDancer Free Version,An advanced piece of software designed to offer network administrators and engineers with the proper tools to manage the various connected devices
Link Maven,A parallel link file transfer tool
Active IPs,"A simple to use application capable of detecting all the active IPs from a local network, that allows you to analyze the addresses"
Ip Lookup for Windows 8.1,"With this simple and lightweight Windows 8.1 application, you can learn what is your current IP address or find the IP of a certain web domain"
GIGABYTE LAN Optimizer,"With support for customizable profiles and managing app priorities, this utility lets you control your network bandwidth with ease, as well as view some information about your PC"
Easy-Data Computer Geek,"A multi-purposed software utility that enables you to perform port scans on the desired IP addresses, manage startup programs and view detailed system information"
Private Shell,SSH client with SecureFTP (SFTP) support
iTMan Inventory Standard,An easy to configure application that enables network administrators to obtain detailed information about computers in their LAN
Samanage (formerly Samanage SaaS IT Asset Management),An online-based dashboard that enables you to manage your IT inventory and conduct service desk activities using tickets and email integration
myip,A simple and easy to use piece of software designed to help you discover your IP address with as little as one press of a button
Microsoft Assessment and Planning Toolkit,"Complex tool which enables you to perform a detailed inventory of all the computers in your local area network using multiple instruments (e.g. WMI, SNMP, PowerShell etc.)"
INADYN,"A lightweight, yet reliable application that allows you to maintain a hostname fixed to a DNS server, even if the IP address is changing"
IEC 870-5-101 Simulator,"Simulator for the IEC 60870-5-101 protocol in master and slave stations, featuring several handy options and configuration settings"
IPSwitcher (formerly IPSwitcher Pro),A handy and reliable application that helps you manage your local routing table and intuitively use all of your TCP/IP network connections
AdminCraft.Com - Route53 Client,Manage your Amazon AWS Route53 DNS Zones
SDR Free Virtual Wifi Router,Use this lightweight and user-friendly application to turn your WiFi-enabled computer into an Internet hotspot supporting as many clients as you want
FreeHotspotRouter,This simple to use application allows you to create a hotspot so you can share your Internet connection to wireless-enabled devices
Secure Cisco Auditor,A reliable software solution whose main purpose is to help you perform complex network audits on your Cisco devices to determine their vulnerabilities
DameWare Remote Support,An enterprise system management application which allows Administrators to go beyond the limitations of Microsoft's MMC
NetworkProcMonitor,An intuitive application that helps network administrators view the processes that are currently running on a local or remote computer
Lepide Active Directory Query (formerly Chily Active Directory Query),"A straightforward software solution that enables you to perform queries on an Active Directory domain, in order to display the available objects and their attributes"
3R PORT SCANNER,"A lightweight utility that enables you to scan the desired IP for any open ports, as well as display them into an easy-to-read list"
NoLag,This is a straightforward application that aims to improve the network configuration of your computer in order to obtain an optimal trading performance
ParserCap,"A small-sized GUI software utility designed for system administrators, security specialists and anyone who wants to analyze network traffic"
PS Network Profile Manager,A software utility that enables you to switch between different proxy settings and create various network profiles for specific connections
NADetector,Monitors and analyzes the network traffic and displays statistical information pertaining to each IP address pair and protocol
NetAdapter Repair All In One,Troubleshoot your network connection and identify problems with your network adapters with the help of this intuitive application
NetHotfixScanner,"Scans for missing hotfixes on all computers in an IP range, exports information to file, and includes a list of hotfixes to select"
Whois,"Obtain domain registration information from WHOIS servers with the help of this simple-to-use tool, that can be handled even by novices"
FreeSnmp,"Compact and straightforward application with support for SNMP, which lets network users view MIBs and perform Walk operations in a comfortable GUI"
Putty Manager,"A reliable and easy to handle tool for Putty users, enabling them to control all their remote sessions from a single tab-based interface"
DNSThing,"A simple and user-friendly utility aimed to provide you with the means to troubleshoot various DNS network issues, with minimal effort"
Ostinato,Keep an eye on network traffic by monitoring send an received items with the possibility to control streams using this handy application
ASUS WL-330gE Wireless AP Utilities,A handy utility for managing the ASUS WL-330gE 4-in-one portable wireless router which can be easily used by anyone due to its intuitive design
