MyIP Basic,"Look up IP address and other network-related information, ping, release and renew hosts, and find out more details about your LAN computers"
Web BRAdmin,A tool for configuring some network settings
FCC DNS Grade,Evaluate the level of a DNS service
Super-ping,"A simple-to-use and portable tool that helps you carry out ping operations, while allowing you to select the connection method (Telnet, SSHv2, Rlogin, or Raw)"
DiscoverIT,Get information from switches and generate Excel report
UDP Config,Check the IP addresses of your HW group devices.
XArp,"Detect ARP attacks, study network information, set the security level, and view logged data using this straightforward and approachable tool"
Connection Test,"A simple-to-use program that helps you test your network connectivity, while offering support for TCP and UDP, and clipboard saving options"
Lepide Event Log Manager,Manage and view detailed reports regarding all logs and critical events that take place in a network with this comprehensive piece of software
IP Calculator,Network info calculator built in Java
Magic Router,"Enables you to route IPs to another computer, as well as analyze protocol and set up firewall, without burdening your computer's performance"
Intel PROSet/Wireless WiMAX,Drivers and management software
Subnet Calculator,Find out whether there are any available IP addresses based on subnet details by simply writing down known variables with result generated as you type
ASUS Bluetooth Suite,A useful management software that allows you to easily connect your Bluetooth devices by using the USB-BT211 Mini Bluetooth Dongle
ASUS NAS-M25 Utilities,A handy utility for managing the ASUS NAS-M25 2-bay Gigabit network storage server
NetBrain Qmap Reader,A tool for viewing and interacting with network Qmaps for work and learning
ASUS USB-N66 WLAN Card Utilities & Driver,A handy utility for managing the ASUS USB-N66 Dual-band Wireless-N900 USB Adapter
Scrutinizer NetFlow Analyzer,Get detailed reports about network utilization for hosts and apps using this comprehensive app for experts wrapped up in a web interface
ASUS USB-N53 Utility,A handy utility for managing the Asus USB-N53 Dual-Band Wireless-N600 USB Adapter
ASUS PCE-N53 WLAN Card Utilities & Driver,A handy utility for managing the Asus PCE-N53 Dual-Band Wireless-N600 PCI-E Adapter
ASUS EA-N66 Ethernet Adapter Utilities,This is a handy utility for managing the ASUS EA-N66 Dual-Band Wireless-N900 Gigabit 3-in-1 AP/Wi-Fi Bridge/ Range Extender
ASUS DSL-N55U Wireless ADSL Router Utilities,This is a handy utility for managing the ASUS DSL-N55U Dual-Band Wireless-N600 Gigabit ADSL Modem Router
ASUS DSL-N12U B1 Wireless ADSL Router Utilities,This is a handy utility for installing and managing the ASUS DSL-N12U B1 Wireless-N 300 ADSL Modem Router
ASUS DSL-N12U Wireless ADSL Router Utilities,This is a handy utility for installing and managing the ASUS DSL-N12U Wireless-N300 ADSL Modem Router
ASUS DSL-N10 B1 Wireless Router Utilities,This is a handy utility for managing the ASUS DSL-N10 B1 Wireless-N150 ADSL Modem Router
ASUS DSL-N10 Wireless Router Utilities,This is a handy utility for installing and managing the ASUS DSL-N10 Wireless-N150 ADSL Modem Router
ASUS WL-330N3G Wireless Router Utilities,This is a handy utility for installing and managing the ASUS WL-330N3G 6-in-1 Wireless-N150 Mobile Router
ASUS WL-330N Wireless Router Utilities,"Set up your ASUS WL-330N 5-in-1 Wireless-N150 Mobile Router by following the preset instructions, discover devices, tweak router settings, and restore the device firmware"
SMB Speed Up,A useful tool that speeds up network share accessing
Portable NetStat Agent,"Network toolkit that comes with support for UDP and TCP/IP monitoring options and netstat, ping, ipconfig, traceroute, WHOIS, HTTP checker, DNS query (nslookup), ARP monitor, and IP route utilities"
SnmpTrapGen,Automate a large number of every day system administrator actions
SnmpWalk,Detect a set of variables that are available for reading on a certain device
SpyGlass,A tool for network sensor visualizing.
Packet Capture,Monitor all your network traffic
ASUS WL-500gP V2 Wireless Router Utilities,This is a handy utility for installing and managing the ASUS WL-500gP V2 Multi-Functional Wireless Router
Ping Manager,"An intuitive and fully-featured network app that helps you ping multiple IP addresses at the same time, as well as perform traceroute and path ping operations"
SPAN Port Configurator,Configures SPAN ports on Cisco switches
ASUS RT-N65U Wireless Router Utilities,This is a handy utility for installing and managing the ASUS RT-N65U Dual-Band Wireless-N750 Gigabit Router
WinHostsManager,"Open the Hosts file to seamlessly view, add, remove and edit entries with IP addresses and host names, using this intuitive application"
ASUS RT-AC66U Wireless Router Utilities,This is a handy utility for installing and managing the ASUS RT-AC66U 802.11ac Dual-Band Wireless-AC1750 Gigabit Router
ASUS RT-N16 Wireless Router Utilities,A useful tool for installing and managing the ASUS RT-N16 Wireless-N300 Gigabit Router
ASUS RT-N15U Wireless Router Utilities,A useful tool for installing and managing the ASUS RT-N15U Wireless-N300 Gigabit Router
ASUS RT-N13U.B1 Wireless Router Utilities,"Install and manage the ASUS RT-N13U.B1 Wireless-N300 Router using a step-by-step approach, view suggestive images, configure router settings, and restore device firmware"
ASUS RT-N12LX Wireless Router Utilities,A useful tool for installing and managing the ASUS RT-N12LX Wireless-N300 Router
ASUS RT-N12E Wireless Router Utilities,A useful tool for installing and managing the ASUS RT-N12E Wireless-N300 Router
ASUS RT-N12B1 Wireless Router Utilities,A handy tool for installing and managing the ASUS RT-N12 B1 Wireless-N300 Router
ASUS RT-N10U Wireless Router Utilities,A handy tool for installing and managing the ASUS RT-N10U Wireless-N150 Router
MiniPing,A simple-to-use software program that helps you keep your Internet connection alive by carrying out ping operations every 60 seconds
TD-VG3631 Easy Setup Assistant,A utility to help you quickly connect and configure your router
TD-W8968 Easy Setup Assistant,Quickly connect and configure your router with this tool
Change Reporter for VMM,Captures all changes and creates comprehensive reports showing virtual machines settings changes.
Multicast tool,Command-line application developed in Java to help users test the network by sending data packets to an IP range to interpret results
Easy WiFi Radar,Have a constant scan process active to find any available wireless Internet to be automatically connected with the help of this small utility
ChkIP (formerly IP Mailer),"Software solution for monitoring and sending IP address via email when the address changes or when needed, adjust some settings to meet your preferences"
SmartHL7 Message Receiver,"A feature-rich, reliable, and easy-to-use HL7 server app."
TL-WDR4300 Easy Setup Assistant,Quickly connect and configure your router and share an USB printer with this tool
TL-WDR3600 Easy Setup Assistant,Quickly connect and configure your router and share an USB printer with this tool
LAN Tornado,A network traffic generator and network testing utility
ConnectionMonitor,"Automatically ping multiple hosts at regular time intervals and save log files using this speedy, uncomplicated and portable app"
PuTTY Manager,A handy application that was especially designed to offer users a simple and easy-to-use means of accessing PuTTY and managing its sessions
We Change IP,"Enables you to change your IP address, SubNet Mask, Gateway, DNS Server, DHCP and proxy, by creating several profiles and switching between them"
pMap,Scan for open network ports
StreamPatrol,Monitoring Solution for your Windows Media Streams
Network Stuff,"Well-rounded program that was built to aid you in viewing various network statistics, wake up a PC remotely, resolve a DNS and view your computer's IP address"
EnGenius Locator,A handy and reliable tool for managing device IP addresses from EnGenius products in a simple and fast manner without having to directly deal with them
WinIP,Allows you to assign a custom hostname or domain name to a computer
EnGenius Zone Controller,Access Point management software
PingyThingy,"Find out whether one or more hosts are alive through the ping command, with options to target more hosts at a time, and save results to file"
LanAdmin,A remote computer manager for medium-sized LANs.
SysTools Network Resource Manager,A handy piece of software designed to provide users with the possibility to easily manage all of their USB connections on the local network
CountryWhois,A utility for identifying the geographic location of an IP address
AthTek NetWalk Enterprise Edition,"A tool designed to help users perform a series of network-related operations, such as network monitoring and packet sniffing and analyzing"
TCP Sender,A lightweight application that can be used for quickly sending TCP packets with custom content and performing IP spoofing operations
ncalc,Java tool for getting network info
InternetShare-home-edition,Share your Internet connection with this easy to use tool
Thinix WiFi Hotspot,An application with a user-friendly interface which you can use to transform your computer into a WiFi hotspot that can easily be configured
Linksys WET610N,Quickly connect your Cisco Linksys wireless adapter with this software
IPFireTray,View the current state of your wireless Internet connection
Linksys AE1200,Quickly connect your Cisco Linksys wireless adapter with this software
Linksys AE2500,"A simple, yet efficient application that you can use to quickly connect, set up and configure your Cisco Linksys wireless adapter"
Linksys AE3000,An intuitive and easy to use application whose main purpose is to quickly connect your Cisco Linksys wireless adapter and initiate a connection
Linksys AE1000,Quickly connect your Cisco Linksys wireless adapter with this software
Socket Utility,A Java tool for debugging apps based on sockets
Freefloat Access*One,The market leading auto-id enabled host access software
i-pi,Displays your IP addresses quickly and easily
ARPScanner,A console application that can scan an IP range
pyTunnel,A SSH tunnel manager to help you with your work
Network Inventory Reporter,"Draw up an inventory of the software and hardware present on remote machines via LAN and your own computer, thanks to this approachable app"
FugueUp! WOL Magic Packet Utility,A simple remote Wake-On-Lan utility that allows you to send messages to remote computers in order to start them up without being in front of the machine
Wake on LAN,"Send packets to the specified MAC address of any computer in your local network to turn it on, as long as it has Wake-On-LAN enabled"
TCPSniffer,"Network analyzer based on Winsocket, which discovers the source and destination of TCP packets, along with host names and statuses"
WhoIs,WHOIS tool that helps you get details about your network provider and geographical location by querying the online RIPE database
Ease Proxy Switch,Switch between multiples proxy server
NetSpeed,"Monitor network traffic to keep track of the current download and upload rate, select the preferred network adapter, and limit the upload and download rate"
TCPForward,Forward TCP connections to any specified remote server and port using this simple command-line tool with straightforward options
Traceroute,"A simple-to-use program that comes packed with limited features for helping you perform traceroute operations, while running on low system resources"
DnsSpeeder,"Use this application as a DNS proxy server in order to process online access requests much faster, while also adding a protection layer to your system"
Easy NIC Test: FastSend,Test your network interface card with this tool
Dibbler,A portable DHCPv6 for you to use
FastIpScan,"Lightweight, portable and very fast software utility that scans a given IP range for available network ports, catering to all user levels"
Nmapsi4,nmap graphical user interface
WifiSpot,Turn your PC into a wireless hotspot on the fly using this particular piece of software that does not rely on its looks to make you happy
SniffPass,Capture the passwords that pass through your network adapter for educational purposes or just for the simple act of pure hacking
Professional Look at Net,"A LAN monitoring tools net scanner, ports scanner and packets sniffer"
EAZ School Proxy Switcher,Quickly switch between your school proxy network and home network without having to perform manual adjustments via Internet Explorer
Mass IP Address Locator,"An intuitive and powerful application that helps users gather information about IP addresses (country and country code), while offering support for batch processing"
NetWrix File Server Change Reporter Enterprise,"Have multiple computers and network objects monitored for successful and failed modification and read attempts, have reports automatically generated, and more"
Whois Tools,A WHOIS and DNS lookup application for web designers and developers that helps them find out detailed information about a domain or IP address
Toska,OpenSSH key management and administration
Xelerator,A Telnet application for UNIX engineers.
Ping Sweep Tool,Gives you the host names of an IP address range in the least possible time with the most primitive network technology put to work
CloudFlare DynDNS Updater,A Simple CloudFlare DNS Updater Client
P2 Shuttle,A powerful network information tool.
IpScanner,Scan the local network for new hosts and keep track of their status using this portable tool packed in a user-friendly interface
ShamCom,"A Terminal program that communicates through various connections, allowing you to test other devices, run scripts and run macros to dial different services"
ReaSoft Network Firewall,Corporate internet access management and total network defense solution
SIP Workbench,A SIP protocol analyzer and viewer
NetIO-GUI,Measure the network speed between two peers
NanoSync,Transfer the music created with the NanoStudio application.
eMailMyIP,Receive an email whenever your public IP address changes
SNMP Agent Simulator,A Java based application that can simulate SNMPv1/v2c/v3 agents
eyeBurst,"Monitor the signal strength of iBurst wireless broadband Internet devices via a graphical representation, customize the graph, and print or export the image to PNG file format"
VPN Dialer,Straightforward and wizard-like application that provides users with a simple means of creating a Virtual Private Network and perform various tests
NFC WebReport,Netflow Collector database analysis
NetGhost,Configuration tool for WLAN
Quick Ping Monitor,"Monitor thousands of IP equipments simultaneously and send message when states of some equipments change, it comes with some solutions for solving errors"
NIC Padlock,"Remotely disable network interface cards for hosts in the local network, schedule their re-enabling, get a list of autostart apps, and more"
FlowTraq,Allows you to analyze the network traffic in greater detail.
Hosts Tray,"Quickly access the Windows Hosts file from the system tray to view TCP/IP data, edit host names and IP addresses, and add comments"
Python Port Scanner,Scan for port availability with this tool
MxTunnel,Provides peace of mind in a dangerous world.
SCS,Shared Connection Simulator
ClearTerminal,An application designed for the needs of M2M and wireless device developers
Visual Audit X4,Hardware and Software Asset Auditing Package
Serial2Socket_proxy,Connect to a serial port using an Internet connection.
Simple Network Tester,"Ping multiple computers to find out statistics with successful, unsuccessful and total pings, using this approachable Java-based tool"
ActiveXperts SNMP Browser,A SNMP application that allows you to analyze the structure of a MIB file
Proxy Finder,Search for your proxy server
Signal Netstat,Simple and portable network information utility that shows remote connections established in LAN and lets you block any one of them
Major Network Tool,Ping network PCs or establish remote connections
Foxy Admin,A program to help system administrators manage their network
SurfCop for Microsoft ISA Server/Forefront TMG,Internet Usage Monitoring and controlling.
UDP Broadcaster,Broadcast all the UDP packets
BMExtreme,Keep track of how much you download from the internet
DarkNetTools,A complete suite of network tools in a command line utility that enables you to learn the most basic network information and ping your host
ASUS RT-N10LX Wireless Router Utilities,A handy tool for installing and managing the ASUS RT-N10LX Wireless-N150 Router
ASUS RT-N56U Wireless Router Utilities,A handy tool for installing and managing the ASUS RT-N56U Dual-Band Wireless-N600 Gigabit Router
IP Range Scanner,"Scan countries' IP addresses, apply filters, and import information (list with IP addresses or HTTP links on each line) from files using this portable tool"
Nassau,See all network connection settings
ASUS RT-N10 Wireless Router Utilities,A simple and easy to use application that was created to assist all users in setting up correctly a Wireless-N150 Router from ASUS
win-sshfs,Intuitive program that helps you mount remote file systems via SFTP protocol while offering support for password or private key authentication methods
SAEAUT SNMP OPC Server Basic,Network management integration with SCADA and HMI using OPC and Web Services
Media Access Control Address Update,MAC Address updater for Intel 10/100/1000 (Gigabit) Ethernet Controller
ASUS RT-N66U Wireless Router Utilities,A handy tool for installing and managing the ASUS RT-N66U Dual-Band Wireless-N900 Gigabit Router
Configuration Center Workgroup,"Real-time windows based network configuration management software for Telnet SSH and SNMP devices from any vendor, it comes with many nice features you can check out"
F-Secure DNS Check,Analyze your computer's DNS settings to check if they are affected by malware infections and restore the settings to a clean state using this portable tool
IO Connection Analysis,TCP/UDP endpoint analysis and mapping software
Internet Kill Switch,Enable or disable your Internet connection with the aid of this portable program that has to offer a basic and simple-to-decode suite of features
uCAN Connect,Smart wireless connection manager
GlobeTrotter Connect,Manage mobile network connections with this software
Toshiba 3G RF Power Control Utility,Have your 3G activated on system startup
SourceTalk,Sort your IP flow data from Cisco routers and switches
OpenBandAid,Maximize your network performance
Toshiba Wireless Manager,A useful application that was especially designed to serve as a means of managing wireless connections for all Toshiba notebooks with such capabilities
ModemWatcher,ADSL Modem statistics at your fingertips
myIPTool,A small IP network configuration application.
MTPuTTY,Multi-Tabbed PuTTY for your favorite SSH client that allows you to better and faster manage multiple PuTTY windows thus processes
TP-LINK 802.1X Client,Connection management utility
TP-LINK Wireless Configuration Utility,"A handy and easy to use tool for configuring wireless adapters, enabling users of TP-LINK hardware devices setup connections much easier"
TD-8840T Easy Setup Assistant,Quickly connect and configure your router with this tool
TD-8817 Easy Setup Assistant,Quickly connect and configure your router with this tool
TD-8816 Easy Setup Assistant,Quickly connect and configure your router with this tool
IP Changer,Lightweight and simple application which was developed specifically in order to help you change your IP address with just a click of the button
TD-W8951NB Easy Setup Assistant,Quickly connect and configure your router with this tool
TD-W8101G Easy Setup Assistant,Quickly connect and configure your router with this tool
TD-W8901G Easy Setup Assistant,Quickly connect and configure your TP-LINK TD-W8901G router with this utility that encases each and every step of the process within
TD-W8151N Easy Setup Assistant,Quickly connect and configure your router with this tool
TD-W8950ND Easy Setup Assistant,Quickly connect and configure your router with this tool
TD-W8951ND Easy Setup Assistant,A handy application that was especially designed to provide those who own a TP-LINK router with a means of easily connecting and configuring their device
NetBan,Auto-Manage access time to use Network / Computer
Hllapi,"Test the HLLAPI functions supported by Nexus Terminal and connect to the service in order to query the session state, get the position of the cursor, and send keys"
Port Scanner,"Small application that scans IP addresses for open ports according to a user-defined set of parameters, conveniently wrapped in portable form"
XRI Explorer,Front-end for OpenXRI written in Java
TD-W8960N Easy Setup Assistant,Quickly connect and configure your router with this tool
TD-W8961NB Easy Setup Assistant,Quickly connect and configure your router with this tool
TD-W8961ND Easy Setup Assistant,Quickly connect and configure your router with this tool
WinTunnel,Tunnel your traffic with this software
TL-WA830RE Easy Setup Assistant,Quickly connect and extend the range of your wireless network with this intuitive application that guides you every step of the way through a wizard
TL-WR340G Easy Setup Assistant,An application that allows you to quickly connect and configure your TL-WR340G through an efficient wizard that guides you through the process
TL-WA730RE Easy Setup Assistant,A useful and effective utility that helps you to quickly connect and extend the range of your wireless network using a TL-WA730RE device
TL-WR941ND Easy Setup Assistant,Quickly connect and configure your router with this tool
TL-WR940N Easy Setup Assistant,Automatically connect and configure your router by simply following a step-by-step approach with the aid of this portable application
TL-WR842ND Easy Setup Assistant,Quickly connect and configure your router with this tool
PassPort,"Software solution that allows forwarding of any local port (on all local interfaces) to any port on a remote server, several ports can be forwarded at the same time"
Etherwatch,Traffic monitor for your network
TTSSH,A simple SSH client
Port Forwarding Wizard Home Edition,"Clear-cut application which enables you to forward a port until the destination IP address is achieved, packed with comprehensive Help contents"
TL-WR841ND Easy Setup Assistant,"A useful, simple and effective application that comes in handy for users who need to connect and configure their router effortlessly"
ServeTrue IQ Proxy (formerly Fastream IQ Proxy Server),A useful and secure web reverse proxy solution for Windows NT
TL-WR1043ND Easy Setup Assistant,Quickly connect and configure your router with this tool
TL-WR2543ND Easy Setup Assistant,Quickly connect and configure your router with this tool
HELIUM PINGer,A simple tool for checking the network and IP addresses
Reverse Port Forwarding Wizard,Access various applications behind a restricted Firewall / Gateway / Router
HTWin,Terminal software for control system developers
NoVirusThanks Socket Sentinel Pro,TCP traffic filtering tool
Zet Switch,The program can easily change settings of the network connection
Linksys EA2700,Lightweight and wizard-like application that provides users with a simple means of connecting to their router and establishing a wireless Internet connection
Show My IP Software,Displays your IP within a blink of the eye!
MBar IP Detector,View your IP host
EzDig,This lightweight application allows you to find out the Domain Name Server details for a certain domain by using multiple queries
Visual Protocol Analyzer,"A powerful and thorough data package analysis tool that lets you keep an eye on incoming and outgoing data with decoded content, call trace data flow, and more"
UDP/IP Network Tester,VoIP network quality measurement instrument wrapped up in a feather-light and portable package that integrates several settings and a graph
NetCheck,"Collect information about the Thomson 585v8 Router, Baudtec PSTN/TW263r4-A2 Router, and Thomson TG782 Router with the aid of gauges, and log data to a file"
Pings,"Check the availability status of multiple hosts by the IP, or URL address by continuously sending pings with this lightweight, and intuitive app"
Communication Configuration Viewer,"Seamlessly view network adapter-related information, such as NIC MAC and IP addresses, subnet mask, default gateway, and DHCP server"
Alchemy Eye Pro,A system management tool that continuously monitors server availability and performance
Uusher Network Management,"Complete set of configuration analysis and interface table monitor tool for network management, it's packed with many nice features that you can check out"
Pooldemon,The way to monitor HTTP traffic
Arcai.com's Netcut-Defender,Internet Connection speed protection
ShunIPCalc,"Work with IP mask and subnet calculators and perform IP and mask conversions from a single environment, as well as generate a list with all subnets"
Toshiba ConfigFree Utility,This package consists of a set of useful utilities that serve to configure Toshiba computers to use both wired and wireless network devices
GoPing,"Ping your IP address or host using multiple threads, view a suggestive chart, and get details about the sent, received, and lost packets"
ByteSphere Agent,A monitoring tool that doubles as a simple Protocol Analyzer and Packet Sniffer.
LAN Search Pro,Search for specific files or for files of a certain kind on your network
Real Network Monitor,"A tool with rich features for monitoring network details, like interface IPs, MAC addresses and gateways, mainly addressing power users"
EmproNetUsgAlert,Bandwidth Usage Monitor
