Autoshares Network Connection Manager,Connect to password protected network storage automatically
WatchYourIP,This software allows you to monitor a certain IP and be notified if any changes occur.
IPv6 Namer,Rename IPv6 addresses with the help of this tool.
TCP Soft Router,Provides TCP communication routing
Pinger!,A tiny ping tool used to quickly ping a large list of hosts
z/Scope Secure Tunnel,A secure communication infrastructure to allow firewall-friendly client-server communications over the Internet.
Power Admin,Easily manage multiple servers with this small tool
NetPing AddIns,Provides additional addins for NetPing
Windows Router Advertisement Server,Autoconfigure IPv6 stateless with the help of this tool.
JClipShare,Share your PC with the help of this tool.
roxCom,A communication program to help you with your work.
Multi Terminal,A terminal communication application to help you with your work.
E.L.A.,Monitors the traffic in local networks and on the Internet
champal,Share your clipboard with the help of this tool.
PCAPU2T,TCPdump format UDP 2 TCP Converter
UDPSZ,Send UDP packets with custom
BirdTerm,A serial port terminal application to help you with your work.
RS232 Sniffer,"A small-sized and portable software application that lets you sniff communication ports easily, with support for creating a log file"
Local Area Network File Send,A useful and practical solution specially designed for users who want to remotely connect to other computers from their network and transfer files
NetRouser Professional Edition,"The software is a Wake On LAN manager that will help users to activate, shutdown and reboot networked computers"
Change My IP,Set static IP with the help of this tool.
PacketTrap DNS Audit,This software was created to help you reduce the time you spend solving network troubleshooting issues.
WOL,"Remotely wake up computers in your network by sending them a wake-on-lan command, provided that you have been granted access from BIOS"
IP Monitor,"A simple-to-use and handy software program that helps you monitor multiple IP addresses, while offering support for notification messages"
Aldo's NET Monitor,"Keep an eye on incoming and outgoing data packages through your network card from a cool desktop panel, and optimize memory with a built-in component"
Modem Tunnel,A modem configuration software to help you with your work.
Netware Quota,Netware support staff utility to their users to easily know the size of their quota
Win2VNC,Control two computers with one keyboard with this tool.
TTWin Lite,"Versitile, high quality terminal emulator. Supports Wyse, IBM 3270/5250, DEC VT, Unix, ICL, HP + more. Telnet, SSH, SSL."
Zero Point One Wireless Networking Utility Helper,Quickly fix the limited or no connectivity error of your wireless network interface card installed on your system with this utility tool
Pinger2009,Small-sized and portable piece of software that can Ping multiple IPs simultaneously with powerful visualized and audible interactivity
PortMarshaller,"TCP/IP port forwarder for monitoring your network when it comes to incoming connections, which can be accessed from a web browser"
Jellyfish,Check your Squid proxy server with the help of this application.
Wifi Card Manager,Organize wireless network connections with this tool.
Ultra Serial Port Monitor,A very useful tool for working with serial ports.
WIFI Studio,An 802.11 (WIFI) Scanner
Share Manager,An easy-to-use application that will help you manage your shared fodlers and files
WinGate VPN,The WinGate VPN uses X509 certificates to identify the VPN server when connecting.
Telmatic,Telnet Automation for Cisco
Pinger,Ping an IP address and websites
WinSuperKit,"Find IP Adresses and their geographical locations, monitor network, compare file, set up date and time with net timer"
WiFiFoFum,"WiFi, GSM and GPS Logger"
LanAmp,Fair music scheduler to be used in LAN environments
Lan Crawler,"Scan Windows shared folders across a local network to gain access to latest file updates, check target availability with the ping command, or scan a range of IPs for targets of interest"
Usage Agent,Monitor and report on internet usage and optionally network card throughput
NetSwitcher for Windows,Save and restore various Windows networking properties
IP Change Monitor,"Keep an eye on your IP address to scan it for changes with options to monitor a particular adapter, and incoming connections from your DynDNS account"
IPToCountry,"Find out the country name and code allocated to a user-defined IP address, process multiple IP addresses at the same time, as well as export data to a plain text file"
Arp scannet,"Lightweight, portable and straightforward tool that enables you to view incoming and outgoing network traffic in a user-friendly UI"
NetworkTrafficMeter,"Monitor your network with this tool, analyze detailed information about your network and bandwidth, such as consumption, speed and MAC address with this easy-to-use application"
Sentinel,Analyzes your network traffic against a set of known attack patterns
Display IP Address,Display IP Address software download to show IP Address as visible to world
LanFriends,"Software solution for scanning your network and seeing which devices are connected, it comes with many more nice features that you can check out"
Vnc Thumbnail Viewer,A Free Open Source Computer Lab Monitoring Software Using VNC
Intellipool Network Monitor,An easy to use and feature rich system for monitoring and reporting
Semaspace,An OpenGL accelerated Browser & Editor for Networks
PacketViewer,"Sniff and view IP packets (TCP, UDP, and ICMP), save the information to plain text files, and convert a custom IP address to a host name or vice versa"
Steel Inventory Free,Mainstream network and system administration
NAK,Network Application Killer
Selkie Quick File Transfer,"A simple, secure, powerful file transfer software for documents, photos, images, emails, music."
PCinfo MagicEYE,"Professional hardware, software audit and emplyees monitoring tool"
sw700vr,A Router reconnect utility
WakeOnLan,"Remotely wake up computers in your local network by sending WOL signals from a command-line interface by specifying the MAC and broadcast address, as well as port"
PortProbe,Probes a series of common ports
WiFi Mesh Simulator Pro,Allows to simulate traffic and routing building between moving in 2D space stations
Blast,"A small, quick TCP service stress test tool."
SNScan,"Identify SNMP-enabled devices on a network, scan for SNMP specific ports (e.g. UDP 161, 193, 391 and 1993), and use standard or custom SNMP community names"
DDosPing,A powerful and efficient network admin utility that serves to remotely detect the most common DDoS programs within a given IP range
Netty Master,Monitor your network with this tool.
Attacker,Set up a list of TCP and UDP ports that you want to listen to and play custom sound notifications upon new connections using this portable application
PingMon,Constantly sends ping requests to a computer
FPipe,A source port forwarder / redirector
Network Troubleshooting Analyzer,"Affordable and easy to use packet analyzer, protocol decoder & traffic monitor"
Bandwidth Reduction Tester,A small sparse matrices generation tool
Ping SX2,"A high-speed, quick access utility for network analysis"
aSc Network Clipboard,A very small and hany tool to copy content over the network
Foundstone CredDigger,A comprehensive software that will be of great help in managing your network's component computers.
Serial Communication Checker,A small program for serial communication
KevTerm,"Emulate VT100/ANSI terminals, keep a history with all your connections, change the background color, customize the text, and adjust the terminal screen size"
The Tube,"Seamlessly set up SSH connections and tunnels to send encrypted data over the web, using this intuitive and portable app for all user levels"
WixTin,"A fully-featured, cross-platform mud/telnet client"
3d Traceroute,An intuitive and portable application that helps users get details about network connections and analyze statistics in a 3D display
TraceMyNet,Trace you local traffic and be on the lookout for potential abnormal events using this simple and straightforward software solution
trafficwatcher,Monitors IP traffic
IP Calculator,IPv4 and IPv6 Subnet Calculator
VSP,A Very Small Ping Application
System Monitor,"Software solution designed to monitor and manage the computers on your network, check memory, disk, session, display and processes"
nets-con,Monitor your network with this tool.
Ethernet,"Change your computer's network configuration with a few mouse clicks, and toggle the IP to either static or dynamic with this portable, straightforward tool"
TCPIPChangeSettings,Copy the TCP / IP settings and store them under a specified name
PortTest,Simple tool to test if certain ports are reachable
iMan,A small tool that will be your own port manager
IP Port Analyzer,"View and save a list with applications currently connected to the Internet, in order to find out their ports and other network details"
NetSend,Send messages to other PCs in your Local Area Network (LAN)
Duplicate SIds Monitor,A tool for monitoring and changing duplicate SIDs in your organization!
ConnectionMonitoring,Allows the user to observe incoming and outgoing network connections
Data Transfer Calculator,"Calculate your network transfer rate using this portable app that lets you input the data amount, transfer speed or transfer duration"
Network Speed Calculator,"Small-sized, portable and straightforward networking utility that instantly calculates connection speed according to a set of parameters defined by the user"
Network Event Viewer,"A compact application that provides a handy set of tools for helping users track event log files, such as real-time monitoring options, email notifications, and remote downloading functions"
SI Ping,SI Ping - Ping remote Internet hosts with free visual Ping for Windows
Ping Utilities,"Check the availability of one or more IP addresses by quickly sending a ping, and save lists of IP addresses to use later on with this practical tool"
Network Manager,A network manager to help you with your work.
BazSyslog,A free application developed to capture syslogs from netscreen devices
SMAC,"Powerful and intuitive MAC address changing (spoofing) tool for Windows computers, with support for generating random MACs and restarting the network adapter automatically"
RFC Assistant,"Useful, simple, yet easy to use RFC browsing software for networking program"
tcpmon,An open-source utility to Monitor A TCP Connection
i-Net,"Ping target IP addresses to check status, gather more details about hosts, retrieve public or local machine IPs, and log all details to file"
Active Administrator,Active Administrator - Enterprise-class Active Directory management and auditing
IP Finder,"Find out the IP address and computer's name of the host based on a user-defined domain, and copy the information to the clipboard with this portable tool"
IP Addr,Displays the IP (Internet Protocol) address of the user's computer
NetCPS,Measure the effective performance on a TCP / IP network
Zamzom Wireless Network Tool,Detect all computers that are connected to your wireless network
ModMon,Will show you a realtime display of your computer's modem status register for a given COM port
IP Pig Port Scanner,A simple tool that scans your computer for all open and closed ports
RaConfig Launcher,This tool starts RaConfig tool minimized to the system tray.
Zonerider Gateway,Broadcast your WLAN and get paid
GetHost,Find out your computer's host name as well as local and public IP address using this portable application with a command-line interface
Easy Proxy Switcher,For those who always changes the proxy address
Fast IP Scanner,Scan IPs on your network with this lightweight tool that assigns threads to each scan in order to speed the process in a non-abusive way
IPRange2CIDR,This program converts IP range to CIDR specification
FreeMeter Revival,"Keep an eye on network traffic from a desktop gadget, or tray icon, with configurable update interval, and extra ping, and traceroute tools"
DNS IP Updater,Dynamic Update Service Windows Client
IPsecPing,A small command-line IPsec endpoint testing and debugging tool
Pingator,Test out the connectivity of several predefined websites with logs generated and saved in a fully automated process thanks to this application
Java Subnet Calculator,"Calculate the maximum or minimum addressable hosts, as well as subnet mask based on a starting IP address for easy and proper network setup"
Network Configuration Management STD,A tool which will let you switch between network profiles without reboot
Animaonline Port Scannr,"A small tool that scans target machine's ports, very fast"
Active Wall Traffic Monitor,A free real time network traffic monitor software for LAN
Vista Firewall Control Plus,Allows application network access control directly from the desktop with the context menu
Vista Firewall Control,"Allow or deny the Internet connection of applications by monitoring their activity and applying rules to zones, in the attempt to prevent malware infiltrations"
WUPS,An UDP port scanner for Windows
WPSweep,Pings a range of IP addresses and lists the ones that reply
WinRelay,TCP / UDP forwarder / redirector that works with both IPv4 and IPv6
Service Availability Tool,A simple tool that can help you verify and troubleshoot network services.
DynDNS Updater,"A reliable utility which can be used to automatically update the IP address database in DynDNS server, then let you access your computer with ease"
Intel IT Director,A software tool that helps small businesses monitor networked PCs
IP Notify,"Keep an eye on your IP address in order to detect changes, and play sound alerts (WAV file format) and popup notifications when your IP address is altered"
Advanced Network Monitor,A LAN and Internet server monitoring tool.
Servantix Network Monitor,An advanced Windows based application that can monitor any IP based device on your network
EtherChange,Change the Ethernet address of the network adapters on your computer using this practical and efficient Command Prompt application
DBProbe,Checks the directed broadcast ping amplification factor for a network
NDPSAddr,Gets IP addresses of NDPS printers
Unsniff Network Analyzer,A trool which will change the way you look deep inside your network
ActiveLAN,IP Switcher tool for logical switchover between several LANs / WLANs on multi-homed notebooks
EffeTech HTTP Sniffer,"Packet analyzer, content rebuilder and http trafic monitor."
SocketTest,"A straightforward socket testing application that can create TCP or UDP clients and servers, allowing you to send custom messages to test the connection"
SMTPTool,"Interact directly with a SMTP server, using a friendly GUI"
Microsoft Research TCP Analyzer,This tool analyzes network traces of TCP connections
VQManager,"With comprehensive built-in and customized reports, it gives network administrators critical insights into bandwidth usage."
STManager,A serial port management tool.
CLI IP Changer,Manage your IP settings with this tool.
Network Information Center,"View information about your network like external and internal IP addresses, default gateway, and MAC address, copy data to the clipboard, and automatically refresh data at a certain number of minutes"
Multi Server Simulator,Multi Protocol Device Simulation for Testing Purposes
orangeNettrace,"Monitor downloads, uploads, traffic, CPU usage and average data."
Hardping Pro,Find all of the devices on your network
NetFast Screen Broadcast,This application can broadcast a computer desktop to other computers over lan
WinNetstat,"Scan the computer for availability of ports with a report generated for different connection types, also showing what processes keep ports busy"
PuTTY SC,A Free SSH Client with Smartcard Support
PathView,A software which ensures reliable delivery of network services - even through the c
Prontonic,A Philips Pronto TSU9600 protocol analyzer
GreyHat Web Scanner,A website vulnerabillity scanner that will check specific weaknesses on a site
SynGUI,A syn packet flooding tool
Show Me IPs,"Shows you what your Internet Protocol Address / IP / is, your LAN IP and your COMPUTER"
WinPing,"Ping a single IP, an entire IP address block, or user specified IP address block ranges"
Nagios Tray Icon,A status of hosts viewer for you to use.
NetTraffic,"A simple, easy to use network traffic monitor"
WinAgents RouterTweak,A useful and specialized terminal shell designed for controlling routers and switches
TesterNet,TCP monitor and Web server monitor will verify that your servers are alive and working well
CnxManager,A network tool for you to use.
Netwatcher Elite,A monitoring tool for you to use.
IconIP,"Find out all your IP and MAC addresses, in addition to DNS servers, host name, port number, gateways, and other relevant network details"
Open Monitor,Monitor your network with this program.
Ethernet Throughput Utility,A useful tol for testing Ethernet bandwidth
ISDNan,A call log analyzer for you to use.
IP Accounting Miner,A network monitoring tool for you to use.
NeSCUS,A network tool for you to use.
ODS Service Manager,An IP tool for you to use.
IPcalc.NET,Calculate network address with this utility.
IP Range Deaggregator,"Calculate the range between a couple of start and end IP addresses with options to also view network mask, prefix, and Cisco wildcard notation"
LAN Viewer,"Automatically monitor local and remote shared resources, set up sound, popup and email notifications upon changes, and search for folders and files by a user-defined range of IP addresses"
Dialup Connection Checker,A tool for connecting to the Internet by the dialup connection which uses a modem
NetMap,"Create network diagrams with workstations, printers, routers/switches, or other devices that you want to monitor, manage licenses, get hardware information, and generate statistics"
AutoBanIP Lite,Monitor fail login attempts on your server with this utility.
iQNetScan,The cost effective IT Asset Management for smaller networks
Hostess,This application is a free utility for maintaining your Hosts file.
FG Ping,Check that a host is reachable or alive
SyncEXP,A lightweight tool for synchronizing files and folders within an intranet using a straightforward interface and task setup process
LANView,"Software package with various network tools that deal with LAN administration tasks in order to get information about all hosts on a network, scan ports, send messages to other hosts, and perform remote shutdowns"
SwitchIP Address,SwitchIP Address allows you to easily switch between two IP configurations for your local workstation
Windows Protocol Binder,A command line tool which can show and alter protocol bindings
NetDrives,"Share entire drives with computers on your network by setting up connections and login information, with options to automatically become active on startup"
SolarWinds IP Address Tracker,"This is a reliable utility that tracks an unlimited number of IP addresses for a unified, at-a-glance view of your entire IP address space"
IP Info,"Simple and portable application that identifies your public IP address and public hostname, accessible from the system tray area"
SDI LPD,SDI LPD is a 32-bit print daemon (RFC 1179) which accepts print jobs from a remote computer
Parallel Port Monitor,A lightweight application that enables you to spy upon the three registers of the parallel port and monitor the behavior of the input pins
P2PVPN,A VPN software for you to use.
Port Tester,"Lightweight, straightforward and simple-to-use Java application that enables network administrators to benchmark port connectivity"
CommTest,"Send and receive data via COM ports, choose between several parity options, enable control flags, switch between hexadecimal and decimal view mode using this portable tool"
WakeOnLAN,A small command line utility makes possible to switch on a computer
MC Get MAC,A small utility that can help you obtain ethernet address
HTTPPing,A small network ping utillity
Opentor Monitor,Monitor your network with this application.
wifi samurai,Store your Wi-Fi settings in the cloud for one click network access from any of your mobile devices using your existing Google account
Switchboard,A free and useful network switching utility
ICMPing,Check the health and status of websites or devices connected to your network by sending custom data packages in the form of a ping with this simple utility
NetPrinters,Manage the networked printer connections stored in a user's profile
Mocha TN3270 for Vista,This application will provide TN3270 emulation for IBM Mainframe Access.
Hosaka TN5250,Access AS/400 series with the terminal emulator Hosaka TN5250
SMS Collection Commander,Manage your network with this tool.
Forever Connected Deluxe,"This application allows you to connect to the Internet with one click, no matter how many times your computer must redial and deal with failed connections"
Forever Connected,"This application allows you to connect to the Internet with one click, no matter how many times your computer must redial and deal with failed connections"
LtTTY,A SSH client for you to use.
SPACEWatch Network Edition,"Reduce your spend on storage area networks, archiving and backup"
FusionSpy,An excellent tool which can be used to monitor WebLogic Server and Tuxedo's key states
PuTTY Terminal Deployer,This is a utility that allows PuTTY secure shell connections
PingDNS,A command line application that will ping your own IP address.
PingSweeper,A very fast IP scanner that uses multi-thread techology
deSleeper,Wake-On-Lan tool that allows off or sleeping machines to be started remotely
Bill Serial Port Monitor,Test and analyse the activity of the serial RS-232 port
WyrmNet,"A simple text-based telnet client that has been written with MUCKs, MOOs, and MUDs"
Jalasoft SNMP Device Simulator,A handy network device simulator
WinWhois,Searches for pertinent information about domain names
Active Directory Account Unlocker,Finds locked out Active Directory Accounts.
PacketCreator,A utility provided to help network administrators to test their network
MAC Address Anonymize,"Don't let your MAC Address to get out in the public, protect it with this easy to use tool"
NetCalc,Easy subnet calculating
Novaxe,The best log analyzer for Juniper Network Firewalls
Port Analyzer,A network port analyzer software
Prominent Pro PC Scan,"A multi-threaded IP, NetBIOS and SNMP scanner"
Keep Alive,A network and server monitoring application
Gateway IP Monitor,"Software solution for monitoring the default gateways IP address by repeatedly connecting to a web page on the Internet, it's packed with all sort of nice features that you could check out"
QuickDNS,"The only slow spot in Analog is it's DNS lookup, which this tool handles"
AnalogX PortMapper,A useful utility that allows you to map and port on your computer to any IP address
HyperTrace,A easy to use GUI version of traceroute
WhoIs ULTRA,A easy to use whois tool that pushes whois to the limit
PacketMon,"An easy to use packet sniffer with advanced rules for filter, CSV output, streaming to a file and more."
AnalogX ITR Client,A GUI tool which gives you quick access to all the normal tools used to diagnose network problems
WinDHCP,A Windows DHCP Server Written in Csharp
Netop Asset Control,Get complete visibility of your IT assets in one central location
My IP,Find out your IP the easy way
Network Probe,An application that acts as a network monitor protocol analyzer
AS WinPING,A ping simulation for Windows
WinNetworkInfo,"Analyze network adapter info and data packets, as well as gateway, IP, ICMP, and TCP information with the help of this application"
SolarWinds Free IP SLA Monitor,Unlock the Power of Cisco IP SLA on Your Network
Quick Net Message,"Send messages to LAN users, type in the text message or paste the information from the clipboard, and check out a list with all computers available in the network"
PortFinder,Select a running application and view the TCP / UDP ports it is currently listening on
Mortens HostAlive,A multi-ping tool to easily check the online status of computers in a TCP / IP network
Mortens Connection Monitor,A tool to monitor an online-connection
MODBUS RTU Communication Tester,A useful and efficient MODBUS RTU communication tester and troubleshooter utility that monitors COM ports in order to sniff the transferred data
Marwan Internet Watcher,Program for monitoring dial-up modem connection
AntiSpoof,A small utility that can update specified ARP entries
Friendly Network Inventory,Audit software and hardware components installed on the computers over the network
Friendly Net Watcher,Track user access and files opened on your computer via the network
Virtual Switcher,Switch between preconfigured network settings with a single click using this neat software solution packed with many tools and features at hand
jWlanScan,A handy network scanning tool
Shunra VE Desktop,Network simulation software
VE Network Catcher Lite,A handy network monitoring tool
mturoute,Debug the MTU values between you and a host
WakeARP,Force 'arp -a' to fill with data.
SNOT,Annotated network sniffing
TCPing,A small console application that operates similarly to ping
Hardscan,A brute-force local netstat replacement
DynIP,An IP Poster for people with dynamic IP addresses
Ping Recorder,"Very similar to the ping.exe operating system command, but it outputs to a csv file"
ShellGuard,A Telnet and SSH client that runs via command-line
IPJudo,A TCP/IP diagnostics toolkit that provides you with many network configuration features
