Advanced PBX Data Logger,"Packed with backup and restore capabilities, this clean application enables you to view information about you calls, view stats and set up custom alerts"
GNS3,A flexible and highly adaptable network topology simulator application that you can rely on to set up networks without needing any expensive hardware
Wireshark,"Advanced network protocol analyzer made to intercept traffic, monitor sent/received data packets, investigate network issues and suspicious activity, generate statistics, featuring color-coded packet types"
Advanced TCP/IP Data Logger,Monitor computers in your local network to intercept and collect network-related details using this app with TCP and UDP support
nProbe,"Monitor, collect, and analyze data packets at high-speed and no data loss because of PF_RING usage, layer-7 application support, NetFlow handling, and more"
Lansweeper,A powerful browser based piece of software that allows you to scan entire networks and offers you a complete overview of the workstations
NetworkMiner,"Simple tool for retrieving specific details about the hosts in the network, offering support for parsing and offline analysis of Pcap files"
Bluetooth MAC Address Changer,Replace the MAC address of your Bluetooth adapter with a user-defined or a random one by relying on this lightweight application
LanFlow,"Draw complex network diagrams by adding devices, uniquely represented connection types, graphic elements and memos, using this intuitive utility"
IPHost Network Monitor Free Edition,"Powerful and intuitive network monitoring program that integrates support for different monitoring modes, alerting features, reports and graphs, as well as web-driven layout and Windows GUI"
IPHost Network Monitor,"A robust, yet user-friendly network and server monitoring application that features e-mail alerting and advanced reporting capabilities"
Archiver.FS,"Archive files located in your network shares with the help of this fast, powerful and scalable software solution that is secure and easy to use"
LiveTcpUdpWatch,"Display live information about all TCP and UDP activity on your system by turning to this lightweight, portable software solution"
AppNetworkCounter,Find out how much network bandwidth is being used by each running application using this tool that monitors sent and received packets
ProcessTCPSummary,Find out the processes that employ TCP connections or that are listening to UDP ports using this simple and straightforward application
Proxy Log Storage Standard Edition,"Monitor the usage of your proxy server and compile reports by analyzing log files, import logs from online and offline sources, and more"
Proxy Log Storage Enterprise Edition,Easily monitor the usage of a particular Proxy server or load existing data from different sources in order to create customized reports
SAMSUNG Laptop to Hotspot Converter,"A software utility that enables you to transform your Samsung laptop into an Internet hotspot, by sharing your wireless connection with other devices"
IP2Location IP-Country-ISP Database,"You can match the range and numbers, in order to identify the country of provenance, plus Internet Service Provider, based on a user's IP address"
Proxy Log Storage Professional Edition,"Analyze large log files, automatically recognize log format, generate thorough reports, which can be exported to HTML, CSV, TXT, or MHT format, and apply filters"
dot11Expert,"Displays advanced statistical information regarding wireless networks, adapters, and access points, providing valuable troubleshooting assistance"
DSLstats,Monitor DSL connections with Broadcom-based routers or modems using graphs and exporting the generated charts to a local folder for later reference
Satellite Restriction Tracker,An efficient application that targets Exede and WildBlue users who need a simple way to monitor and record bandwidth and network usage
ExpanDrive,"Connect to your favorite storage account, such as Dropbox, Microsoft OneDrive or Amazon S3, and extract any data with this simple and easy to use application"
Serial Port Redirector,"Create virtual serial ports and redirect data to a remote host with minimal effort, by using this straightforward and intuitive application"
PingInfoView,"Ping multiple host names and IP addresses, then watch the result in one table with the help of this lightweight piece of software"
Simple IP Config,"Change your network settings, including your IP address, subnet mask, gateway and DNS server, with the help of this practical application"
Activity Monitor,"Monitors multiple remote computers at the same time, logging keystrokes, opened programs, visited websites, as well as sent and received email messages"
Total Network Inventory,"Gather information about all computers in a network (e.g. system, CPU, video info, storage details, network, peripheral devices) and build a detailed report"
AIDA64 Network Audit,"A powerful and comprehensive auditing tools that can help network administrators to collect information, allowing for an efficient monitoring of the resources"
WiFi Manager,"Manage the wireless network connections in your range, view valuable information, and connect to any preferred access point using this tool"
XenArmor Social Media Blocker,Block your system form accessing any of the worlds most well-known social media platforms with the help of this neat and easy-to-use app
ActiveXperts Network Monitor,"Monitor servers, workstations, devices and applications in your network and get instant notifications in case a component fails to respond"
RouterPassView,Lightweight and portable application that helps users quickly recover passwords from router configuration files if backups exist
Network Notepad,"Design network diagrams using various predefined objects, insert custom text, as well as print and save the diagrams to BMP, GIF or PNG file format"
BozTeck VENM Remote Desktop Manager,A powerful application that was designed in order to provide you with a means of remotely managing your workstations and servers
WinSSHTerm,Simple-to-use GUI for PuTTY or KiTTY that makes it easier to manage multiple SSH sessions and offers support for file transfers and X applications
SmartCode VNC Manager Standard Edition,A powerful and comprehensive remote administration and monitoring software solution tailored to meet the needs of any network administrator
SmartCode VNC Manager Enterprise Edition,"Reliable and complete remote administration, network management and monitoring software that offers support for a large variety of tools"
JDisc Discovery,"Perform numerous scans on your network, discover connected devices and organize the information you retrieve in an efficient manner"
JDisc Discovery Professional Edition,"Perform various network scans, discover and identify devices that are connected to it and organize the output information according to your needs"
Network Asset Tracker Pro,Network inventory solution that provides in-depth information about your LAN computers and works without special agents remotely installed
SoftPerfect Switch Port Mapper,Analyze and identify the computers connected to each switch port and find out which ports are available with this handy and reliable software solution
Suricata,Intrusion detection and prevention system (IDS/IPS) that can be installed on network hardware to alert against attempts to penetrate security
IP-MAC Scanner,"A straightforward application designed for IP and MAC scanning, providing users with network monitoring and connection analysis capabilities"
10-Strike LANState Pro,Easily monitor your LAN connected PCs and devices with this capable application that features map and diagram views together with various statistics tools
Managed Switch Port Mapping Tool,A useful network management application that is especially created to find and identify devices that are attached to network switch ports
CommView for WiFi,A program for capturing traffic on 802.11a / b / g / n networks alongside some powerful features regarding packets as well as nodes
AdRem NetCrunch,"Network mapping, monitoring, alerting and reporting software application wrapped in a comfortable and user-friendly interface, dedicated to power PC users"
10-Strike LANState,"Scan your network, find hosts, place them on a network diagram, and monitor their state visually within minutes using this utility"
AggreGate,"IP network management, monitoring and device supervision solutions for enterprise servers, in a comprehensive application bundle"
KiTTY,"This application is a fork from version 0.67 of the PuTTY SSH/ Telnet client, providing users with additional features and important enhancements"
LOGINventory,A useful tool designed to query and catalog all of the information regarding the hardware and software available on your computer and on your network
Spiceworks Desktop,"Manage your software and hardware components, as well as patches on your network with the help of this advanced, web-based application"
Stunnel,"Simple utility that can add SSL functionality to inetd daemons like POP2, POP3, and IMAP servers or standalone ones (NNTP, SMTP and HTTP)"
10-Strike Network Diagram,"Well-rounded tool which comes bundled with a long list of templates, enables you to create network diagrams and save them to a file"
Intel PROSet/Wireless WiFi Software,"Manage wireless connections and devices easier, create hotspots and conduct testing routines using this toolkit for Windows 10, 8.1 and 7"
Nmap,Lightweight CLI-based utility that makes uses of raw IP packets in novel ways to determine what hosts are available on the network
Zenmap,"You can easily track the network activity, as well as the traffic on a specific website, based on the available hosts, with this application"
Homedale,"An intuitive and portable application that helps users monitor the signal strength of multiple WLAN access points, and view the information graphically represented"
IT Asset Tool,"Perform an advanced hardware and software inventory for all the PCs connected to a network, with this straightforward application"
Slitheris Network Discovery,A reliable network monitoring application that can retrieve detailed information about all the workstations and devices in your network
NetSetMan,Network settings manager that lets you create up to six different network profiles and easily switch through them from the system tray
IPSentry Network Monitoring Suite,Comprehensive suite of utilities that can help administrators monitor hardware and software components in a network in order to maintain it in top shape
Sync Breeze Enterprise,"Network client for Sync Breeze Server that lets you synchronize files across multiple locations on computers via LAN, backed by a task scheduler and custom commands"
PRTG Network Monitor,Monitor your network traffic with a powerful program that allows you to stay in touch with important LAN or WAN statistics by using a web-based interface
Network Monitor,"An application designed to provide users with network monitoring capabilities from a single, comprehensive graphical user interface"
Apache Syncope,Free and open-source digital identity management system that facilitates access to its components and settings via a web-based interface
Kickdrive Zero,Configure and test CAN and CANopen bus networks using this tiny and portable app which includes approachable options and settings
Advanced IP Scanner,Fast and easy-to-use IP scanner that lets you create your own favorite list for easier network management and allows you to connect to other PCs using Radmin
QuickWho,"Get information about a particular website or IP address by using the Whois function, all thanks to this intuitive graphical interface"
MiTeC Network Scanner,"Keep a close eye on the network you are administrating with the help of this feature-packed and easy to use multi-threaded IP, NetBIOS and SNMP scanning tool"
SoftPerfect Connection Emulator,Versatile testing environment that can emulate various network connections in order to assess the functionality of network applications under different conditions
Unbound,Resolve the DNS caches and make sure you no longer access malicious websites filled with ads and other threats when attempting to access the Internet
HomeNet Manager,"Clean application which enables you to easily manage your network connection, as well as analyze and gather information pertaining it"
ZOC Terminal,Transfer information via Secure Shell or Telnet and establish multiple host connections simultaneously using this powerful application
Advanced Host Monitor,"A fully-featured application that comprises a wide range of network tests (e.g. Ping, email, web) and several alert modes (warning messages, email notifications)"
Syslog Center,Keep track of the events that are happening over the network you are administering and receive automatic pop alerts of critical task with this app
OsMonitor Monitoring Software,"Monitor the PC activities of your employees, including running or installed programs, Internet browsing habits and chat conversations"
Termite,A lightweight and easy to handle RS232 terminal that aims to provide you with a simple means of sending text messages using serial communication
CurrPorts,"Displays a complete list of ports that are currently opened, alongside detailed information regarding the applications that uses them"
WhatsApp Blocker,Avoid procrastination and improve your productivity at work with the help of this easy-to-use and extremely helpful software application
Hardware Inspector,Inventory tracking solution for corporate and networks IT infrastructure that keeps track of expendables issued to and from the storage place
IP-Tools Lite,Learn everything there is to know about your computer and the network configuration so you can manage them better using this comprehensive toolkit
Get IP and Host,"Obtain the IP address from a host or the other way round, with the help of this lightweight and straightforward piece of softwarwe"
IP-Tools,"All-in-one TCP/IP-related toolkit that shows information about your computer and the network configuration, also providing advanced network management tools"
TCP COM Bridge,"Capture data from a COM port and share, split, redirect or expose the port to an Ethernet address by creating a bridge using this app"
MyConnection Server,A reliable utility that delivers a broad range of support managed automated and user initiated self-help connection testing and monitoring services
EMCO WakeOnLan Free,Power up computers with one click by sending WOL packets to other workstations in the same network with the help of this easy-to-use tool
EMCO WakeOnLan Professional,"Turn on multiple computers on your network automatically, by sending WOL packets on a specific schedule, with this intuitive program"
Network LookOut Administrator Pro,An application designed to monitor activity on computers connected to a network and provide multiple control options and functions
TMeter,"Advanced network traffic monitor that lets you manage network interfaces, filters, rules, users and groups, view graphs, generate reports, and more"
Advanced NMEA Data Logger,"This simple, yet reliable application can provide you with real-time activity logs from various sources, such as IP addresses or COM devices"
TCP Over HTTP Tunnel,A HTTP tunneling solution that allows advanced users to manipulate requests and responses in such a way that they bypass proxy and firewall restrictions
WifiChannelMonitor,"A Wi-Fi traffic capturing application that enables you to view a list of all the access points, the connected clients and their identification information"
Active Directory Change Tracker,"Intuitive program that helps you monitor Active Directory configuration, export reports to HTML, CSV or XLSX file format, search for specific changes, and enable email notifications"
ThorroldFox IP Monitor,A lightweight and comprehensive software solution that you can easily use to keep track of any changes that your IP address undertakes
Whois View for Windows 10/8.1,A simple-to-configure program for Windows 8 that helps you perform WHOIS operations for getting information about a domain based on its name
What's IP for Windows 10/8.1,"View detailed information about your network interfaces, including adapter type, IPv4 and IPv6 addresses, authentication and encryption mode"
NEWT Professional,"A network inventory scanner specially designed for users who want to browse the network, as well as switch between scanning and discovery modes"
Tuxler,Change your real IP address by choosing between different IP locations from all over the world and automatically alter the IP address at a custom number of minutes
CommView Remote Agent for WiFi,"Monitor WLAN traffic on your machine from any remote computer that has CommView for WiFi installed, with this lightweight application"
IpSharkk,Effortlessly change your IP address with the help of this lightweight piece of software that lets you choose from a multitude of servers
TamoGraph Site Survey,An application that you can use to generate detailed maps of a wireless network's signal strength enabling you to see where it needs improvement
Computer Geek's Calculator,"Perform network address calculations, as well as other math-related operations with the help of this efficient and feature-rich utility"
PTP Track Hound,"Capture, visualize and analyze PTP (Precision Time Protocol) network traffic with the help of this well-thought-out piece of software"
Network Notepad Professional Edition,"Straightforward and simple-to-use application that enables you to build network diagrams, save them to the hard drive and print them"
Kramer Network,"A comprehensive software solution that enables you to remotely configure, route, control and manage Kramer Pro -AV devices over a network"
PingPlotter Free,"Trace the route between you and a target address, in order to diagnose latency and packet loss issues, with this simple and intuitive tool"
PingPlotter Standard,You can trace graphical and statistical representations of your ping in order to identify the source of slow web performances on your PC
PingPlotter Pro,"Monitor and troubleshoot your networks, gather information about remote hosts, track latency, packet loss and others, with this useful tool."
iReasoning MIB Browser Enterprise,A useful application that was especially created in order to support network admins in their handling of management information bases
iReasoning MIB Browser,A powerful and easy-to-use application worth having when you need to manage multiple SNMP devices and monitor network traffic with ease
iReasoning MIB Browser Professional,"Advanced program that helps network administrators manage SNMP network devices and applications with the aid of a built-in trap receiver for sending and processing SNMP traps, MID table view mode, device snapshots, graphs, ping and traceroute tools"
MIB Browser,"Analyze SNMP protocols for your network connection to view MIB definitions, notes, and status, with this practical, lightweight application"
SoftPerfect Network Scanner,"A multithreaded IP, SNMP, NetBIOS scanner that can detect hidden shares on a LAN, aiming to provide a reliable security tool for all network administrators"
WifiHistoryView,"Extracts information about the current and past wireless network connections of your computer, displaying a complete list you can export"
Data Usage for Windows 10/8.1,"Collect detailed network traffic reports with the aid of graphs, pie charts, and statistics provided by this app that helps you correlate all this info with your Internet bill"
Xshell Free,"Powerful SSH, TELNET, SFTP, RLOGIN and SERIAL terminal emulator with strong security features, emulation customization, script support, and more"
ScanEngine Explorer,"Scan the network and remotely monitor various processes, websites or devices that are connected to the Internet, with this simple tool"
Xshell,"A powerful SSH, TELNET and RLOGIN terminal emulator for connecting to any remote workstation in order to perform various maintenance operations"
NetProxy,"Listens to a port of IPv4 or IPv6 HTTP and binary connections, and allows you to tunnel data and redirect the traffic to another network location"
Hide Mia Cloud VPN,A straightforward and easy to use application which enables you to quickly change your IP address to one of several available options
Wireless Network Watcher,"Simple, easy-to-use and lightweight software application that allows you to scan your network and view all the connected devices"
LanSpy,"Network security scanner that can provide you with extensive information about networked computers, packing a wide range of tools within an intuitive UI"
NetworkActiv AUTAPF,Configure the TCP and UDP ports forwarding on your computer with the help of this comprehensive and professional software solution
Asoftis IP Changer,"Change your computer's IP address to hide your real identity while navigating online, and thus protect your privacy during browsing sessions"
NoMachine,Connect to other computers remotely and control the target workstation as if you were in front of it with this intuitive application
EMCO Network Software Scanner,"Collects a list of installed applications from Windows PCs found on a network, together with their version and other relevant information"
LoriotPro,"An advanced and efficient piece of software designed to help you monitor and manage routers, servers, switches and other various network components"
Wifinian,"View all wireless LAN profiles saved on your system and connect or disconnect from networks based on signal strength, with this small, open-source utility"
Acrylic Wi-Fi HeatMaps,Create and update wireless network heatmap to measure the Wi-Fi signal throughout your establishment using this software application
Zabbix,An open source solution for monitoring network resources that also provides database management and graphical data representation
FBENCH,A reliable network testing and performance assessment utility that enables you to run data receiving and sending tests for both TCP and UDP connections
NamicSoft Scan Report Assistant,"Reads Nessus scan reports, displaying the content in an organized table and enables you to convert them to a Word or an Excel document"
LanTopolog,"A simple-to-use application that helps users analyse network connectivity issues, while offering support for email and sound notifications"
WakeMeOnLan,A versatile and reliable software utility that enables you to turn on one or more computers remotely by sending Wake-on-LAN (WOL) packets
Acrylic Wi-Fi Professional,This comprehensive and reliable application enables Wireless network analysts to monitor occurring connections and data transmission speeds
PSIsniff,A user-friendly and efficient application that can scan your computer for network adapters and analyze the connections in your LAN
Atomic Whois Explorer,"Intuitive and fast tool developed to help you process WHOIS database automatically, get info about email addresses, phone and fax numbers, and other details, as well as export data to DOC or XLS file format"
TamoSoft Throughput Test,A comprehensive and easy to use server and client application that can test the performance of your network connection in real time
EMCO Remote Installer Free,"Get thorough lists of applications installed on remote computers with the possibility to repair them, or even install new ones from a distance"
EMCO Remote Installer Professional,"Install, uninstall or repair applications remotely on computers in your network and keep track of deployed software using this professional tool"
NetResident,Efficiently monitor network activity of individual or multiple PCs with this application that offers deep packet inspection and customizable alerts
10-Strike Network Monitor Pro,Monitor distributed and remote networks to make sure everything is working in the expected parameters with this software solution
10-Strike Network Monitor,"Clear-cut application which enables you to easily monitor your network servers and switches, as well as all other network devices"
NetworkTrafficView,A comprehensive and practical network monitoring application that provides you with the necessary tools to create detailed HTML reports about data traffic
ELM Enterprise Manager,"Real-time monitoring of servers and event logs, surveillance of network workstations, devices and firewalls, with integrated alerting system"
Permission Analyzer,Get the access rights per user or user group and enhance the network security by editing permissions in the network via this tool
Colasoft Capsa Free,Straightforward application which enables you to analyze your network and easily obtain information for troubleshooting and monitoring
Colasoft Capsa Enterprise,"Detect network bottleneck and bandwidth use, identify network vulnerabilities and solve possible problems in one's network with this app"
LAN Speed Test,Test the speed of your Local Area Network with the minimum amount of fuss by relying on this simplistic yet very efficient piece of software
NovAtel Connect,Conveniently access the numerous features of your NovAtel receiver faster without having to rely on a terminal emulator using this application
Viscosity,An efficient and reliable OpenVPN client that provides you with a rich interface for managing multiple virtual private network connections
WifiInfoView,This is a reliable and versatile utility whose main purpose is to display information about wireless networks such as MAC address and signal quality
FOCA,Test various websites and extract metadata and other hidden bits of information in the documents you find by turning to this app
Virtual Router Plus,Use your computer as a method to connect other WiFi enabled devices to the Internet with the help of this easy to use application
